{
  "intent_version": "1.0.0",
  "skill": "photometric-analysis",
  "consumed_lighting_layout_intent": "electrical/photometric-analysis/examples/uk-drawing-office-strict-ugr/synthetic-upstream-intent.json",
  "photometric_grid": {
    "achieved_avg_illuminance_lux": 762,
    "achieved_min_illuminance_lux": 598,
    "achieved_uniformity_u0": 0.78,
    "ugr_max": 17.5,
    "ugr_target": 16,
    "uniformity_target": 0.7,
    "target_illuminance_lux": 750,
    "task_area_compliant": false,
    "grid_point_count": 108,
    "non_compliance_flags": [
      {
        "message": "Max UGR 17.5 exceeds drawing-office limit 16 per BS EN 12464-1 Table 5.3 row 5.34. General-office UGR-class opal panels (≤19) used in drawing-office context that requires UGR-class-rated luminaires with batwing/asymmetric distribution (UGR ≤16). Substitute luminaire selection.",
        "reference": "BS EN 12464-1:2021 Table 5.3 row 5.34 (drawing-office UGR limit) + CIE 117 (UGR method)",
        "severity": "critical"
      }
    ],
    "ies_source_summary": {
      "all_verified": false,
      "verification_status_lowest": "synthetic_reference_C3"
    }
  }
}
