{
  "intent_version": "1.0.0",
  "skill": "photometric-analysis",
  "consumed_lighting_layout_intent": "electrical/lighting-layout/examples/uk-open-plan-office-10x8-dali/intent-out.json",
  "photometric_grid": {
    "achieved_avg_illuminance_lux": 752,
    "achieved_min_illuminance_lux": 612,
    "achieved_uniformity_u0": 0.81,
    "ugr_max": 18.2,
    "ugr_target": 19,
    "uniformity_target": 0.6,
    "target_illuminance_lux": 500,
    "task_area_compliant": true,
    "grid_point_count": 99,
    "non_compliance_flags": [],
    "ies_source_summary": {
      "all_verified": false,
      "verification_status_lowest": "synthetic_reference_C3"
    }
  }
}
